artist,genre,lyric
nicki minaj,hip-hop/rap,demdemdemdem demdem demdemdemdem demdemdemdem demdem demdemdemdem   uh i'm in my prime optimus sagittarius so you know i'm an optimist man keep it all real i'm a prophetess okay so at least you took an l off your bucket list bucket list it's time to make hits and it's time to diss how you still dissin' still can't find some hits okay was it worth it dummy i ain't mind a bit still on that show gettin' no chips time to dip  pre i i i ii ii i okay i'm still fly just bagged a white guy okay ritchie like guy and i still eat thai want the nicki cheat code come on bitch nice try   let's be real all you bitches wanna look like me wanna be in demand get booked like me wanna run up in the lab and cook like me but ain't nan you hoes pussy good like me pussy so good his ex wanna still fight me face so pretty bitches wish they could slice me she just mad 'cause he never bought her ice like me i cut all my niggas off but they would still wife me still wife me   rap bitches tell they team make 'em like barbie had to come off ig so they can't stalk me all they do is copy looks steal music too want to see what bitches do when they lose the blueprint i mean the pinkprint ho let it sink in i spoke to jay the other day he's still the kingpin he's still the only nigga that i woulda signed to if i ain't sign to wayne's perfectly designed crew 'cause we the big three don't need a big speech we made the biggest impact check the spreadsheet that's lil weezy the barbie and drizzy drake niggas gettin' more cheese kissy face i'm a bad bitch fuck the bitch uh bitch get slick i'ma cut the bitch i'm a bad bitch suck some dick okay if that bitch get slick i'll cut the bitch i'll cut up the bitch i'll gut the bitch okay had to fuck up the bitch man fuck the bitch won't shoot her but i will gunbutt the bitch when we say fuck the bitch dick up the bitch she was stuckup so my niggas stuck up the bitch still draggin' her so don't pick up the bitch get the combination to the safe drug the bitch know the whole operation been bugged the bitch  pre i i i ii ii i okay i'm still fly just bagged a white guy okay ritchie like guy and i still eat thai want the nicki cheat code come on bitch nice try   let's be real all you bitches wanna look like me wanna be in demand get booked like me wanna run up in the lab and cook like me but ain't nan you hoes pussy good like me pussy so good his ex wanna still fight me face so pretty bitches wish they could slice me she just mad 'cause he never bought her ice like me i cut all my niggas off but they would still wife me still wife me   they would still wife me they would still wife me yup him too he would still wife me ahh ha   when it come to stealin' flows these birds is fluent but they stutter when get asked 'bout the queen's influence when it's clear they bite me i'm flattered they like me i don't wanna check bitches tell 'em wear their nikes barbie tingz that's barbie tingz big barbie tingz that's barbie tingz big barbie tingz that's barbie tingz uh barbie dreamhouse barbie rings that's barbie beach house barbie benz uh barbie white picket barbie fence all tea all shade bitch all offense if you ever try to confiscate barbie's ken i'ma put you in the box where my dollies been chop it up and the next stop garbage bin 'cause you hoes too old to be gossipin' i'm just tryna find out when the new porsche come in
nicki minaj,hip-hop/rap,nicki minaj he said he came from jamaica he owned a couple acres a couple fake visas 'cause he never got his papers gave up on love fucking with them heart breakers but he was gettin' money with the movers and the shakers he was mixed with a couple things ball like a couple rings bricks in the condo and grams to sing sing left arm baby mother tatted five year bid up north when they ratted anyway i felt him helped him put him on lock seat belt him took him out to belgium welcome bitches this pretty that's seldom this box better than the box he was held in i'm momma dee in that order i call him daddy like daughters he like it when i get drunk but i like it when he be sober that's top of the toppa i never fuck with beginners i let him play with my pussy then lick it off of his fingers i'm in the zone   nicki minaj  lil wayne they holler at me but it's you you this ain't high school me and my crew we can slide through give it to you whenever you want put it wherever you want baby it's yours anywhere everywhere baby it's your world ain't it alright baby it's your world ain't it uh   lil wayne she got a nigga at home and one on the side best friend is a dyke they fucked around a few times her and her momma alike so all they do is fight i tell her make me some money she tell me make me a wife i tell her bitch you crazy fuck wrong with you and excuse my french but i'm a long kisser and then she try to tell me i'm the only one that's hittin' and i say what about them niggas she say what about them niggas you right what you doing tonight put on something tight don't judge me i get life she love me like a brother but fuck me like a husband pussy like a oven too hot to put my tongue in all i had to do is rub it the genie out the bottle pussy so wet i'ma need goggles she tell me that's it's mine i tell her stop lyin' mine and who else she say worry 'bout yourself lil tune   nicki minaj they holler at me but it's you you this ain't high school me and my crew we can slide through give it to you whenever you want put it wherever you want baby it's yours anywhere everywhere baby it's your world ain't it baby it's your world ain't it   nicki minaj i know you want it boy i see you tryin' just keep on pushin' i'ma let you slide in just close your eyes and this horizon it's ready come get you some yeah yeah yeah yeah
nicki minaj,hip-hop/rap,uhhuh uhhuh yo ayo i was on the plane with dwayne you can call me whitley i go to hillman listen i'm the baddest in the school the baddest in the game excuse me honey but nobody's in my lane when you was in new york you was fuckin' the yankee i was fuckin' with base i was pitchin' to franky these bitches so cranky get 'em a hanky mmommy i'm cold gimme my blankie  interlude woah woah woah woah woah woah woah ok ok woah woah holiday wait hold on hold on holiday you can't give it to 'em dry like that you gotta get that shit wet first nigga like come on now you gotta prep them for shit like that i got you they can't just get that shit right off the top like you gotta bring that shit back bring that shit the fuck back let's go  verse uhhuh uhhuh yo ayo i was on the plane with dwayne you can call me whitley i go to hillman listen i'm the baddest in the school the baddest in the game excuse me honey but nobody's in my lane when you was in new york you was fuckin' the yankee i was fuckin' with base i was pitchin' to franky these bitches so cranky get 'em a hanky mmommy i'm cold gimme my blankie flyer than a kite i get higher than rapunzel keep the snow white i could buy it by the bundle step your cookies up 'fore they crumble don't be actin' like the cardinals and gon' fumble fumble cause i'm a steeler fresh up out the dealer all the dope boys gon' feel her flow so sick i need a healer fuck is my mac concealer i be out in queens on the back of four wheewheewheewheewheewheewheelers i'm a big deal that's why i get more head than a pigtail put some ranch out im gettin' the munchies i think i'll have a rap bitch for my entree 'cause they be thinking they can spit spitshine my shoes you know i keep a bad bitch let me sign your boobs i'm the only thing hoppin' like a kangaroo i mean the only thing poppin' like a can of brew listen you should buy a sixteen 'cause i write it good that 808 woofwoof 'cause i ride it good and bitches can't find they man 'cause i ride it good i'm the wolf where is little reda riding hood   now if you see a ittybitty piggy in the market give that bitch a quarter and a car tell her park it i don't fuck with pigs like assalaamalaikum i put 'em in a field i let oscar mayer bake 'em and if you see a ittybitty piggy in the market give that bitch a quarter and a car tell her park it i don't fuck with pigs like assalaamalaikum i put 'em in a field i let oscar mayer bake 'em  interlude it's like i just singlehandedly annihilated you know every rap bitch in the building like like i'm nicki minaj nicki lewinsky nicki the ninja nicki the boss nicki the harajuku barbie like i mean i don't even know why you girls bother at this point like give it up it's me i win you lose hahahahahahaha oh shit hahaha yo  refrain i'm a bad bitch i'm a i'm a bad bitch i'm a bad bitch i'm a i'm a bad bitch i'm a bad bitch i'm a i'm a bad bitch i'm a bad bitch i'm a i'm a bad bitch   hahahahahaha i told you i told you before i told you y'all was gonna have to pick my fruit out now listen in addition to pickin' my fruit out i want y'all to start going to the boutiques know what i'm saying get some get some get some crazy shit for me i want i want you know leopardskin and you know i want i want all that crazy lizardskin shit like you know make sure you you can be my personal shopper hahahahahahahahahahahaha aaaaayyyyooooo woo uhhuh uhhuh uhhuh ugh
nicki minaj,hip-hop/rap,nicki minaj i got somethin' for you lookin'ass niggas week and a half i'ma be in that ass pause it's like i'm working on an album and a mixtape at the same motherfucking time  prehook young thug okay cool okay bool i love her i'ma save her yes like danny glover i'ma call my partner 'fore i fuck her mother i pass them a molly now they kiss each other  hook young thug every time i fuck i gotta hit me least like two bitches for that dope he whipped you need a new wrists foreign car outside that bitch got two digits money stand like eight feet just like two midgets   young thug who the fuck told you that young thugger thugger don't fuck up the beat i got six cars and i also got rentals and all of 'em tinted no i'm not nipsey not from la but i got keys to the city i fuck it i suck it i beat it down then she beat me to the ceilin' stoner my lifestyle i'm livin' too wild i came to make you proud that money keep her around in love with her head i can't turn it down can't wait for my time to come back around she see that you don't got lil haiti's style plus i just seen snoop on girls gone wild i just bought a bentley and a bitch came with it young rich nigga hittin' million dollar licks balling in new york like a motherfucking knick you better have them racks you ever want to hear me spit and everywhere i go i got a pass like the staff i'm goin' off top like a motherfuckin' layup 57 six shots like al i left ten bands in a motherfuckin' cab  prehook young thug okay cool okay bool i love her i'ma save her yes like danny glover i'ma call my partner 'fore i fuck her mother i pass them a molly now they kiss each other   nicki minaj every time i come out i aint ever with no new bitches these bitches is stealing i'ma sue bitches dripping down his dick this pussy too vicious vicious every time i fuck him i say whose is it yo who the fuck told 'em that they was like nicki oh no bitches didn't i'ma give bitches a minute of shine then i'll tell 'em good riddance good riddance to raise a child it might take a village but i wouldn't know cause these bitches my sons yes they was and they still is gave him the kitten now that nigga smitten told him to hop in my foreign and then i said no i'm just kiddin' hell of a livin' you bitches on chitlins when i come out of my mansion i sprinkle some bread to the pigeons bbbbbut bitches is lyin' they lyin' they lyin' they lie in they bio so i ain't fuckin' with chickens unless i got pico de gallo girls is plottin' what more could they steal tell justin timberlake that i am comin' for jessica biel bitch i'm a starrah you niggas i holla tomorrow doors go up 'cause i am too rich to cop a gallardo no regular doors on aventadors painted it pink just so i could take pictures while you rented yours hhhhell of a ticket hhhhhell of a price i want it i get it i wire the money i never think twice i am not gay but let's be precise 'cause if she pretty then watch it 'cause i'ma be fuckin' ya wife  hook young thug every time i fuck i gotta hit me least like two bitches for that dope he whipped you need a new wrists foreign car outside that bitch got two digits money stand like eight feet just like two midgets   young thug i knew i was gonna run my money up and everybody didn't all these niggas pussy niggas tellin' on they partner hope the pussy nigga get a bigger sentence pussy nigga play i'm coming back with the k and i'ma shoot that motherfucker 'til he livid bitches wanna see a nigga thumb through it fast i'ma name myself young thugga tenant 00 bands at a time i fronted you bands but you i don't like using profanity but the young thugger will cut you all of my cups are muddy i fuck my bitches' buddies i just want nut like buddy all of my bitches buddies panamera with the tinted roof all the niggas' dogs goin' roof top notch shawty nigga ring came with karats young nigga rich jewelry colder than the attic if she ain't a virgin then that bitch is only average i can't even hear ya baby get rid of the static i can't learn a bitch but i learned mathematics i just ball her down whenever she call my pattern  prehook young thug okay cool okay bool i love her i'ma save her yes like danny glover i'ma call my partner 'fore i fuck her mother i pass them a molly now they kiss each other  hook young thug every time i fuck i gotta hit me least like two bitches for that dope he whipped you need a new wrists foreign car outside that bitch got two digits money stand like eight feet just like two midgets
beyoncé,r&b,beyoncé i've been drinkin' i've been drinkin' i get filthy when that liquor get into me i've been thinkin' i've been thinkin' why can't i keep my fingers off it baby i want you nownow why can't i keep my fingers off you baby i want you na na cigars on ice cigars on ice feelin' like an animal with these cameras all in my grill flashin' lights flashin' lights you got me faded faded faded baby i want you na na can't keep your eyes off my fatty daddy i want you na na drunk in love i want you  pre beyoncé we woke up in the kitchen saying how the hell did this shit happen oh baby drunk in love we be all night last thing i remember is our beautiful bodies grindin' up in that club drunk in love   beyoncé we be all night love love we be all night love love   beyoncé we be all night and everything all right no complaints from my body so fluorescent under these lights boy i'm drinkin' park it in my lot 7 i'm rubbin' on it rubrubbin' if you scared call that reverend boy i'm drinkin' get my brain right armand de brignac gangster wife louis sheets he sweat it out like washrags he wet it up boy i'm drinkin' i'm singin' on the mic to my boy toys then i fill the tub up halfway then ride it with my surfboard surfboard surfboard grainin' on that wood grainin'grainin' on that wood i'm swervin' on that swervin'swervin' on that big body been servin' all this swerve surfin' all in this goodgood hahaha  pre beyoncé we woke up in the kitchen saying how the hell did this shit happen oh baby drunk in love we be all night last thing i remember is our beautiful bodies grindin' up in that club drunk in love   beyoncé  jayz we be all night love love we be all night love love i'm nice right now hold up   jayz that d'ussé is the shit if i do say so myself if i do say so myself if i do say so myself hold up stumble all in the house time to back up all of that mouth that you had all in the car talkin' 'bout you the baddest bitch thus far talkin' 'bout you be reppin' that third i wanna see all that shit that i heard know i sling clint eastwood hope you can handle this curve uh foreplay in a foyer fucked up my warhol slid the panties right to the side ain't got the time to take drawers off on sight catch a charge i might beat the box up like mike in '97 i bite i'm ike turner turn up baby no i don't play now eat the cake anna mae said eat the cake anna mae i'm nice for y'all to reach these heights you gon' need g 4 5 6 flights sleep tight we sex again in the morning your breasteses is my breakfast we goin' in we be all night   beyoncé we be all night love love we be all night love love   beyoncé i'm never tired never tired i been sippin' that's the only thing that's keepin' me on fire we on fire didn't mean to spill that liquor all on my attire i've been drinkin' watermelon i want your body right here daddy i want you right now can't keep your eyes off my fatty daddy i want you   beyoncé we be all night love love we be all night love love  produced by noah detail fisher beyoncé knowles timbaland jerome harmon boots and andre proctor
beyoncé,r&b,messy mya what happened at the new wil'ins bitch i'm back by popular demand  refrain beyoncé y'all haters corny with that illuminati mess paparazzi catch my fly and my cocky fresh i'm so reckless when i rock my givenchy dress stylin' i'm so possessive so i rock his roc necklaces my daddy alabama momma louisiana you mix that negro with that creole make a texas bama i like my baby heir with baby hair and afros i like my negro nose with jackson five nostrils earned all this money but they never take the country out me i got hot sauce in my bag swag  interlude messy mya  big freedia oh yeah baby oh yeah i oh oh yes i like that i did not come to play with you hoes haha i came to slay bitch i like cornbreads and collard greens bitch oh yes you besta believe it  refrain beyoncé y'all haters corny with that lluminati mess paparazzi catch my fly and my cocky fresh i'm so reckless when i rock my givenchy dress stylin' i'm so possessive so i rock his roc necklaces my daddy alabama momma louisiana you mix that negro with that creole make a texas bama i like my baby heir with baby hair and afros i like my negro nose with jackson five nostrils earned all this money but they never take the country out me i got hot sauce in my bag swag   beyoncé i see it i want it i stunt yellow boneit i dream it i work hard i grind 'til i own it i twirl on them haters albino alligators el camino with the seat low sippin' cuervo with no chaser sometimes i go off i go off i go hard i go hard get what's mine take what's mine i'm a star i'm a star 'cause i slay slay i slay hey i slay okay i slay okay all day okay i slay okay i slay okay i slay okay we gon' slay slay gon' slay okay we slay okay i slay okay i slay okay okay okay i slay okay okay okay okay okay okay okay ladies now let's get in formation 'cause i slay okay ladies now let's get in formation 'cause i slay prove to me you got some coordination 'cause i slay slay trick or you get eliminated  verse beyoncé when he fuck me good i take his ass to red lobster 'cause i slay when he fuck me good i take his ass to red lobster we gon slay if he hit it right i might take him on a flight on my chopper i slay drop him off at the mall let him buy some j's let him shop up 'cause i slay i might get your song played on the radio station 'cause i slay i might get your song played on the radio station 'cause i slay you just might be a black bill gates in the making 'cause i slay i just might be a black bill gates in the making   beyoncé i see it i want it i stunt yellow boneit i dream it i work hard i grind 'til i own it i twirl on my haters albino alligators el camino with the seat low sippin' cuervo with no chaser sometimes i go off i go off i go hard i go hard take what's mine take what's mine i'm a star i'm a star 'cause i slay slay i slay hey i slay okay i slay okay i slay okay i slay okay i slay okay i slay okay we gon' slay slay gon' slay okay we slay okay i slay okay i slay okay okay okay i slay okay okay okay okay okay okay okay ladies now let's get in formation i slay okay ladies now let's get in formation 'cause i slay prove to me you got some coordination 'cause i slay slay trick or you get eliminated i slay   beyoncé okay ladies now let's get in formation i slay okay ladies now let's get in formation you know you that bitch when you cause all this conversation always stay gracious best revenge is your paper   girl i hear some thunder golly look at that water boy oh lord
beyoncé,r&b,part  yoncé   let me hear you say hey ms carter hey ms carter say hey ms carter hey ms carter give me some   see me up in the club with fifty'leven girls posted in the back diamond fangs in my grill brooklyn brim with my eyes sitting low every boy in here with me got that smoke every girl in here got to look me up and down all on instagram cake by the pound circulate the image every time i come around g's up tell me how i'm looking babe   boy this all for you just walk my way just tell me how it's looking babe just tell me how it's looking babe how it's looking babe i do this all for you baby just take aim and tell me how it's looking babe how it's looking babe tell me how it's looking babe looking babe   drop the bass mane the bass get lower radio say speed it up i just go slower high like treble pumping on the mids ya man ain't ever seen a booty like this and why you think ya keep my name rolling off the tongue 'cause when he wanna smash i'll just write another one i sneezed on the beat and the beat got sicker yoncé all on his mouth like liquor  hook yoncé all on his mouth like liquor yoncé all on his mouth like liquor yoncé all on his mouth like liquor like like liquor like like like liquor yoncé all on his mouth like liquor yoncé all on his mouth like liquor yoncé all on his mouth like liquor like like liquor like like like liquor   beyoncé beyoncé are you happy to be in paris are you happy to be in paris beyoncé beyoncé beyoncé  part  partition   driver roll up the partition please   driver roll up the partition please i don't need you seeing 'yoncé on her knees took fortyfive minutes to get all dressed up we ain't even gonna make it to this club now my mascara running red lipstick smudged oh he so horny yeah he want to fuck he popped all my buttons and he ripped my blouse he monica lewinsky'd all on my gown  pre oh there daddy daddy didnt bring the towel oh baby baby we better slow it down took fortyfive minutes to get all dressed up we ain't even gon' make it to this club   take all of me i just wanna be the girl you like girl you like the kind of girl you like girl you like take all of me i just wanna be the girl you like girl you like the kinda girl you like is right here with me right here with me right here with me right here with me   driver roll up the partition fast hey driver roll up the partition fast over there i swear i saw them cameras flash handprints and footprints on my glass handprints and good grips all on my ass private show with the music blasting he like to call me peaches when we get this nasty red wine drip well talk that trash chauffeur eavesdropping trying not to crash  pre oh there daddy daddy now you ripped my fur oh baby baby be sweating out my hair took fortyfive minutes to get all dressed up we ain't even gon' make it to this club   take all of me i just wanna be the girl you like girl you like the kind of girl you like girl you like take all of me i just wanna be the girl you like girl you like the kinda girl you like is right here with me right here with me right here with me right here with me   hello estce que tu aimes le sexe  le sexe je veux dire  l'activité physique le coït tu aimes ça  tu ne t'intéresses pas au sexe  les hommes pensent que les féministes détestent le sexe mais c'est une activité très stimulante et naturelle que les femmes adorent   take all of me i just wanna be the girl you like girl you like the kind of girl you like girl you like take all of me i just wanna be the girl you like girl you like the kinda girl you like is right here with me right here with me right here with me right here with me hello   bzzbzzbzzbzzbzzbzzwop
