artist,genre,lyric
cardi b,hip-hop/rap,cardi b look i just want to break up all your shit call your mama phone let her know that she raised a bitch then dial tone click and fuck your little fake ass friends come around actin' like they my bros i seen y'all little group texts where you all like to brag about your hoes and you can tell your little bitch i screenshotted all her naked pics oh you wanna send nudes to my man wake up and see your boobs on the 'gram lil' bitch i cannot stand you right hand to jesus i might just cut all the tongues out your sneakers smash your tv from best buy you gon' turn me into left eye i don't wanna hear 'bout invasion of privacy i had a feeling it turns out you lie to me i'm holdin' back everything that's inside of me how you out fuckin' with bitches that follow me  pre ali tamposi  cardi b my heart is beating like it's bleeding out you sleepin' you sleepin' you sleepin' you sleeping like a baby everyone was right about you now and you creepin' you creepin' you creepin'   ali tamposi  cardi b i went through your phone last night i went through your phone last night saw some things i didn't like i went through your phone last night it's killin' me killin' me killin' me oh   cardi b all i can see is you and her in different scenarios beyoncé on my stereo resentment on repeat i'ma make your bowl of cereal with a teaspoon of bleach serve it to you like here you go nigga bon appétit look did you give it to her raw you love her or nah you risk your whole home for a ho from the bar you really want them hoes you can have them bitches you don't even cheat with no badder bitches this shit is eatin' me you sleepin' peacefully gettin' more mad at you thinkin' 'bout stabbin' you don't even know that you this close to dyin' you gon' wake up like why you got an attitude  pre ali tamposi  cardi b my heart is beating like it's bleeding out you sleepin' you sleepin' you sleepin' you sleeping like a baby everyone was right about you now and you creepin' you creepin' you creepin'   ali tamposi  cardi b i went through your phone last night i went through your phone last night saw some things i didn't like i went through your phone last night it's killin' me killin' me killin' me oh   ali tamposi  cardi b it's killin' me it's killin' me killin' me killin' me oh it's killin' me it's killin' me killin' me killin' me oh it's killin' me it's killin' me killin' me killin' me oh it's killin' me   ali tamposi  cardi b i went through your phone last night i went through your phone last night saw some things i didn't like i went through your phone last night it's killin' me killin' me killin' me oh
cardi b,hip-hop/rap,cardi b that boy cassius cardi nnnonstop   cardi b  offset came through drippin' drip drip came through drippin' drip drip came through drippin' drip drip diamonds on my wrist they drippin' ice came through drippin' drip drip came through drippin' drip drip came through drippin' drip drip diamonds on my wrist they drippin' ice came through drippin' drip drip came through drippin' drip drip came through drippin' drip drip diamonds on my wrist they drippin' ice came through drippin' drip drip came through drippin' drip drip came through drippin' drip drip diamonds on my wrist they drippin' ice   cardi b give me little something to remember cardi tryna make love in a sprinter yeah quick to drop a nigga like kemba go lookin' like a right swipe on tinder woo shit on these hoes shit light up my wrist on these hoes wrist now i look down on these bitches down i feel like i'm on stilts on these hoes woo fuck ya' baby daddy right now right now anna mae got cake by the pound pound go down eat it up don't drown mac n' cheese in the bowl how it sound sound i got that gushy yeah that's a fact but i never been pussy i've been that bitch since pajamas with footies won mvp and i'm still a rookie like woo i gotta work on my anger ayy might kill a bitch with my fingers ayy i gotta stay outta gucci woo i'm finna run outta hangers woo is she a stripper a rapper or a singer i'm busting bucks in a bentley bentayga ride through your hood like bitch i'm the mayor you not my bitch then bitch you in danger   cardi b  offset came through drippin' drip drip came through drippin' drip drip came through drippin' drip drip diamonds on my wrist they drippin' ice came through drippin' drip drip came through drippin' drip drip came through drippin' drip drip diamonds on my wrist they drippin' ice  refrain offset bitch you a thot ain't trickin' thot thot put her on her knee make her lick it lick it patek on my wrist and it's glistenin' drip drip the bitch got mad i dissed her hey   offset shawty you ain't nothin' to a rich nigga nothin' i'll put a check on a bitch nigga brrt fuck your whole set and your clique nigga fuck 'em got a gang full of dud and some broke niggas dud diamonds on me what's the price price i'm not gettin' involved with the hype hype i'm too rich to get into a fight too rich 50 racks got my jeans fittin' tight 50 racks pay the price and them boys come and wipe ya' wipe ya' we had to dispose of the diaper dispose yeah we trap every week every night whoa word my move we too smooth no indictments hey yeah freakazoid lightnin' lightnin' 57 90 in this breitling breit' when i got a mil i got excited million for the cash i'ma turn to michael myers baguettes keep dripping droppin' drip my wrist all liquid watches watch told the bitch jump on my dick and pop it yeah get a little bitch a deposit hey brrt   cardi b came through drippin' drip drip came through drippin' drip drip came through drippin' drip drip diamonds on my wrist they drippin' ice  refrain offset bitch you a thot ain't trickin' thot thot put her on her knee make her lick it lick it patek on my wrist and it's glistenin' uh drip drip the bitch got mad i dissed her hey   takeoff taketakeoff came through drippin' drippin' i ain't never slippin' i'm a pimp pimp fuckin' with a quarter million nigga what a feelin' feelin' abort the mission nigga they be tellin' off and squealin' squealin' splash took a bitch to piccadilly splash water in my ear gave a nigga wet willy wet willy came through drippin' spillin' walkin' with the bag bag tryna get my niggas all a milli stack it to the ceilin' ceilin' shootin' at civilians 'villians i'm the one dealin' i could make a killin' killin' bags can you smell it when i vacseal it uh flag nigga throw it up don't care about your feelings fuck 'em ooh what is this what you wearin' i be drippin' what cal ripken's hit a nigga ken griffey home run the bitch got thick so i guess she ate jiffy when she leave with me i'ma fly her back to the city for sure  4 quavo go get the bag on the day off tacks go get the rings out the playoffs rings pots in the beat it's a bake off packs fuck on her then she get laid off smash big boy tools maaco big boy make a bitch dance with a draco dance walkin' with the cheese that queso cheese that's huncho fuck the rodeo huncho private jet we don't do layover whew one call i'm havin' your bae over brrt walk out the spot with a makeover woo got her addicted to payola addicted hey   cardi b  offset came through drippin' drip drip came through drippin' drip drip came through drippin' drip drip diamonds on my wrist they drippin' ice came through drippin' drip drip came through drippin' drip drip came through drippin' drip drip diamonds on my wrist they drippin' ice came through drippin' drip drip came through drippin' drip drip came through drippin' drip drip diamonds on my wrist they drippin' ice came through drippin' drip drip came through drippin' drip drip came through drippin' drip drip diamonds on my wrist they drippin' ice
cardi b,hip-hop/rap,kehlani ooh ooh ring ring ring ring   kehlani you don't hit my line no more oh oh you don't make it ring ring ring ring i can't keep this on the low i want you to make it ring ring ring ring   cardi b should i call first i can't decide i want to but a bitch got pride the switchin' up shit is what i can't fuck with i'm feelin' you but you hard to get in touch with and you ain't hit me up in a while actin' like you don't know what number to dial you quit then that's it i'ma throw in the towel 'cause a nigga only gon' do what you allow you don't want this gun smoke learn to text with your nose if your thumb broke i don't care if we get into it and i stall on your ass better still wake up to missed calls from your ass nigga   kehlani you don't hit my line no more oh oh you don't make it ring ring ring ring i can't keep this on the low i want you to make it ring ring ring ring   cardi b nah nigga now you gon' have to call me call me 'cause i'm lookin' at these messages they on me yeah actin' like they ain't niggas that want me let another nigga in your spot and you gon' be hot nigga coffee you gon' be sick to your stomach hit me when you free 800 it's emergency call me 9 'cause right now i'm out here tryna find someone the ring on my phone ring on my finger brrr you actin' like you ain't tryna do either yeah once a good girl watch me turn diva here goes my heart i put it on speaker oh   kehlani you don't hit my line no more oh oh you don't make it ring ring ring ring i can't keep this on the low i want you to make it ring ring ring ring   kehlani you used to be on my line on my tick all the time yeah love it when you make me feel like you don't mind when i ain't got time for you and no it don't go to my head i'm only arrogant in bed i just love to know you wanna spend time with me instead now you all caught up yeah you all caught up and you done left me alone yeah you was all fed up ready for the next step wanna be on your own said i just miss you i just miss us baby all i know is   kehlani you don't hit my line no more oh oh you don't make it ring ring ring ring you don't make it ring baby i can't keep this on the low yeah yeah oh i want you to make it ring ring ring ring
cardi b,hip-hop/rap,verse look they gave a bitch two options strippin' or lose used to dance in a club right across from my school i said dance not fuck don't get it confused had to set the record straight 'cause bitches love to assume mama couldn't give it to me had to get it at sue's lord only knows how i got in those shoes i was covered in dollars now i'm drippin' in jewels a bitch play with my money might as well spit in my food bitches hated my guts now they swear we was cool went from makin' tuna sandwiches to makin' the news i started speakin' my mind and tripled my views real bitch only thing fake is the boobs get money go hard you're mothafuckin' right never been a fraud in my mothafuckin' life get money go hard damn fuckin' right stunting on these bitches out of mothafuckin' spite ain't no runnin' up on me went from nothin' to glory i ain't tellin' y'all to do it i'm just tellin' my story i don't hang with these bitches 'cause these bitches be corny and i got enough bras y'all ain't gotta support me i went from rag to riches went from wic to lit nigga only person in my fam to see six figures the pressure on your shoulders feel like boulders when you gotta make sure that everybody straight bitches stab you in your back while they smilin' in your face talking crazy on your name trying not to catch a case i waited my whole life just to shit on niggas climbed to the top floor so i can spit on niggas said i was just tryna chill and make bangers bangers tell all these old bitches they in danger stop the thing on my hip whip bitches into shape brrrt that's what i call a fuckin' waist trainer you gon' run up on who and do what who i think y'all got your story screwed up yeah i came here to ball is you nuts i don't want your punkass man i'm too tough facts i'm the one that's killin' shit hands down hands down if you got a problem with me say it now say it 'cause i don't wanna hear no sneak dissin' huh 'specially not from one you weak bitches i'm on go like i don't see no stop lights skrrt i'm steppin' out every day prom night facts so if it's all love show me love then huh 'cause you hatin' on a bitch that's what it sounds like beast mode that's how i give it up nigga hoodie low that's how i'm pullin' up just 'cause i been on the road don't mean i been on the run and you gon' have to learn to hold your tongue or hold the gun brrrt woo and we all know you ain't that type no i smack you and the bitch that you act like yeah i started gettin' money bitches upset cash they remind me of my pussy bitches mad tight nails done hair laid keep 'em both laced laced cocome through shinin' with a rollie bust face shine heheadshot headshot tell 'em closed case ain't no bitch spittin' like this since '08 i don't trust no nigga i don't fear no bitch fear no bitch whole life been through some fucked up shit fucked up shit they say i'm too that oh i'm too this when you see what i've seen you end up like this woo i walked into the label where the check at where the check cardi b on the charts ain't expect that where that bitch that was claimin' she a threat where i'ma put a louboutin where her neck at they say i'm too ratchet they say i act wild i act wild wild i'm tryna whip the foreign like a bad ass child bad ass child skrrt they caught me slippin' once tell 'em try that now try that now cardi b know it's me hear that blap sound blap   man i said we gon' win knock me down nine times but i get up ten look myself in the mirror i say we gon' win knock me down nine times but i get up ten look myself in the mirror i say we gon' win knock me down nine times but i get up ten yeah but i get up ten knock me down nine times but i get up ten bitch woo   i'ma make a fuck nigga feel me yeah said i'ma do a broke bitch filthy ah i'ma make a fuck nigga feel me grrr said i'ma do a broke bitch filthy grrr   we gon' win knock me down nine times but i get up ten woo yeah i said we gon' win knock me down nine times but i get up ten bitch grrr
cardi b,hip-hop/rap,chance the rapper i'm livin' my best life yeah yeah i'm livin' my best life made a couple m's you know igh huh   chance the rapper said i'm livin' my best life said i'm livin' my best life made a couple m's with my best friends turned all my l's into lessons you see the whip pullin' up it's like skrrt dreams pullin' up i'm like skrrt i'm livin' my best life it's my birthday at least that's what i'm dressed like   cardi b i'm like big pop' mixed with pac i'm like makaveli yeah you need some little caesar's pizza i be hot and ready woo nigga you a pussy and a rat you like tom and jerry nigga you ain't ballin' you just talkin' that's that commentary huh i was in the field man i slaved for this yeah had to talk to god dropped down and prayed for this to my surprise he replied said you made for this i seen the car i wanted then i went and paid for it cash cash hit the tayk i hit the race hit the dash dash that's when they came for me on twitter with the backlash cardibissoproblematic is the hashtag i can't believe they wanna see me lose that bad they talkin' junk and they stink these hoes mad trash i'm gigglin' can't let the devil have the last laugh ain't no more beefin' i'm just keepin' to myself i'm my own competition i'm competin' with myself brrr   chance the rapper i told y'all i'm livin' my best life woo i told y'all i said i'm livin' my best life ayy i made a couple m's with my best friends turned all my l's into lessons skrrt skrrt skrrt you see the whip pullin' up it's like skrrt like skrrt dreams pullin' up it's like skrrt like skrrt i'm livin' my best life it's my birthday at least that's what i'm dressed like chance i'm the rapper   chance the rapper you don't like money i can see it your eye you don't like winnin' i can see it in your tie better be careful with these women when you trickin' send it fly sheesh she count money in her sleep and she don't ever spend the night but she trappin' and she had to make it happen for her life don't be mad because she havin' shit you had it your whole life we had baggage on our flight we had badges on our asses you got passes in your life you had gadgets on your bike god work magic god work magic god work magic in my life woo and that guala like iyanla 'cause that bag just fixed my life woo woo and y'all know good and damn well i don't want no champagne woo but can we please get some more champagne ugh please no andre g like 'venchy reach like 'bron james pep talk from yoncé 'member my hands had ash like pompeii now they hold cash won't peak like dante   chance the rapper i told y'all i said i'm livin' my best life i told y'all i said i'm livin' my best life ayy i made a couple m's with my best friends turned all my l's into lessons skrrt skrrt skrrt you see the whip pullin' up it's like skrrt skrrt skrrt like skrrt dreams fillin' up i'm like skrrt like skrrt i'm livin' my best life it's my birthday at least that's what i'm dressed like   cardi b i said i never had a problem showin' y'all the real me hair when it's fucked up crib when it's filthy waybeforethedeal me striptopaythebills me 'fore i fixed my teeth man those comments used to kill me but never did i change never been ashamed never did i switch story stayed the same i did this on my own i made this a lane y'all gotta bear with me i been through some things went from smallass apartments to walkin' red carpets pissy elevators now every dress is tailored this some reallife fairy tale binderella shit i got further than them hoes said i will ever get and that only goes to show that only god knows i took pictures with beyoncé i met mama knowles i'm the rose that came from the concrete and arose i'm like gold i'm life goals man i'm chosen i'm floatin' ayy   chance the rapper i told y'all i said i'm livin' my best life i told y'all i said i'm livin' my best life ayy i made a couple m's with my best friends turned all my l's into lessons hey hey hey hey hey you see the whip pullin' up it's like skrrt like skrrt dreams pullin' up i'm like skrrt like skrrt i'm livin' my best life it's my birthday at least that's what i'm dressed like   chance the rapper skrrt skrrt it's goin' down right now skrrt skrrt jamie foxx in your town like skrrt skrrt money pilin' up man all the blessings comin' down you don't know 'bout nothin' you don't know you don't know 'bout nothin' ayy you don't know 'bout nothin' you don't know 'bout nothin' i told y'all i told y'all you don't know 'bout nothin' i t i told y'all i told y'all you don't know 'bout nothin' told y'all i t i told y'all you don't know 'bout nothin' you don't know you don't know 'bout nothin' you don't know 'bout nothin' ayy ayy ayy ayy you don't know 'bout nothin' ayy ayy ayy ayy you don't know 'bout nothin' ayy ayy ayy ayy you don't know 'bout nothin' ayy ayy ayy ayy
cardi b,hip-hop/rap,goes for all my nasty hoes yeah aalright alright alright alright alright from across the globe woo hol' up this goes for all my nasty hoes yeah alrightalright alright alright alright alright from across the globe look uh   now i said luxury apartments wow i'm young and i'm heartless yeah there's a bitch that aint my bitch then that bitch is a target brrr lawyer is a jew he gon' chew up all the charges don't matter if you fuck with me i get money regardless cash   that guap guap get some chicken guap guap get some bread guap guap get some chicken guap guap get some bread bitch you pressed you can flex get some money ho tell me why you stressed   now i said hoes down gs up gs up you know how i'm rockin' but my watch is freezed up ice i can't wait until they drop that lamborghini truck skrrt i'm careful where i park it hoes will have it keyed up them bitches getting beat up brrrat slim waist ass fat fat my shit is caked up my bad bitch activate yeah without no makeup this that collard greens cornbread neck bone back fat get it from my mama and you don't know where your daddy at knickknack paddywhack give a dog a bone bone put it on him then your nigga never comin' home home i'ma flex like a 'roid i'm a ten she a 'droid stupid ho unimportant unattractive unemployed   get some guap guap get some chicken guap guap get some bread guap guap get some chicken guap guap get some bread bitch you pressed you can flex get some money ho tell me why you stressed ugh guap guap get some chicken  refrain i need that cheese shorty show me where it's at boy please whatever you play with me guapguap chickenchicken i might pop up where you at boy please whatever you makebelieve guapguap chickenchicken now with me it's only facts boy please whatever expensive weave and my checks is worth some racks ugh   yeah pop that pussy like you ain't popped that pussy in a while pop that pussy like poppin' pussy is goin' out of style pop that pussy while you work pop that pussy up at church pop that pussy on the pole pop that pussy on the stove make that pussy slip and slide like you from the 05 put your tongue out in the mirror pop that pussy while you drive spread them asscheeks open make that pussy crack a smile lock your legs 'round that nigga make him give your ass a child woo gimme some neck gimme a check pussy so good make a nigga invest get a little spit i'm gettin' it wet i'll get it back up just give me a sec' give him some vag' i'm gettin' a bag give him some ass i'm gettin' some raf when i'm done i make him cum but then he comin' off that cash   get you some guap guap get some chicken guap guap get some bread guap guap get some chicken guap guap get some bread bitch you pressed you can flex get some money ho tell me why you stressed ugh guap guap get some chicken  refrain i need that cheese shorty show me where it's at boy please whatever you play with me guapguap chickenchicken i might pop up where you at boy please whatever you makebelieve guapguap chickenchicken now with me it's only facts boy please whatever expensive weave and my checks is worth some racks ugh   alrightalright alright alright alright alright alrightalright alright alright alright alright alrightalright alright alright alright alright alrightalright alright alright alright alright
cardi b,hip-hop/rap,cardi b al t mclaran  megan thee stallion  in this house there's some  in this house there's some  in this house there's some in this house hol' up i said certified freak seven days a week wet and gushy make that pullout game weak woo ah   cardi b yeah yeah yeah yeah yeah you dealin' with some wet and gushy bring a bucket and a mop for this wet and gushy give me everything you got for this wet and gushy   cardi b  megan thee stallion beat it up baby catch a charge extra large and extra hard put this cookie right in your face swipe your nose like a credit card hop on top i wanna ride i do a kegel i'm kinda wild look at my mouth look at my thighs this water is wet come take a dive tie me up like i'm surprised let's roleplay i'll wear a disguise i want you to park that big mack truck right in this little garage make me dream make a stream out in public make a scene i don't cook i don't clean but let me tell you how i got this ring ayy ayy   megan thee stallion gobble me swallow me drip down the side of me yeah quick jump out 'fore you let it get inside of me yeah i tell him where to put it never tell him where i'm 'bout to be huh i'll run down on him 'fore i have a ayy runnin' me pow pow pow talk your sh bite your lip yeah ask for a car while you ride that ah while you ride that you really ain't never gotta mwah him for a thang yeah he already made his mind up 'fore he came ayy ah now get your boots and your coat for this wet and gushy ah ah ah he bought a phone just for pictures of this wet and gushy pay my tuition just to kiss me on this wet and gushy mwah mwah mwah now make it rain if you wanna see some wet and gushy yeah yeah   cardi b  megan thee stallion look i need a hard hitter need a deep ah need a henny drinker need a woo smoker not a garter snake i need a king cobra with a hook in it hope it lean over he got some money then that's where i'm headed cookie a just like his credit he got a beard well i'm tryna wet it i let him mmm now he diabetic i don't wanna mmm i wanna woo i wanna ah i wanna sco' i want you to touch touch that huh that swing in the back of my my talk game is fire dasani dasani it's goin' in dry and it's comin' out soggy i ride on that thing like the cops is behind me yeah ah the way that i spit and now he tryna sign me woo  4 megan thee stallion your honor i'm a freak handcuffs leashes switch my wig make him feel like he cheatin' put him on his knees give him somethin' to believe in never lost a fight but i'm lookin' for a beatin' ah in the food chain i'm the one that eat ya if he ate my ah he's a bottomfeeder big d stand for big demeanor i could make ya bust before i ever meet ya if it don't hang then he can't bang you can't hurt my feelings but i like pain if he ew me and ask whose is it when i ride the yeah i'ma spell my name ah   cardi b yeah yeah yeah yeah you dealin' with some wet and gushy bring a bucket and a mop for this wet and gushy give me everything you got for this wet and gushy now from the top make it drop that's some wet and gushy now get a bucket and a mop that's some wet and gushy i'm talkin' wap wap wap that's some wet and gushy macaroni in a pot that's some wet and gushy huh   al t mclaran there's some  in this house there's some  in this house there's some  in this house there's some  in this house there's some  in this house there's some  in this house there's some  in this house there's some  in this house there's some  in this house there's some  in this house
